Banco/Billetera,Se requiere,Día de la promoción,Descuento,Rubro,Establecimiento,Tope de reintegro,Condiciones
Banco Ciudad,n/a,"Lunes, Martes, Miércoles, Jueves, Viernes, Sábado, Domingo",2x1,Cine,Atlas,,"Promoción válida para la República Argentina, todos los días, aplica el beneficio 2x1 en funciones tradicionales 2D y 3D. Participan de la promoción los clientes que al momento de comprar sus entradas en www.atlascines.com seleccionen el tipo de precio Tarjeta Débito Banco Ciudad y abonen con las Tarjetas de Débito Visa y Maestro emitidas por el Banco Ciudad. Abonando el valor de 1 entrada a tarifa de mayor valor de cada complejo se entregará además otra entrada para la misma función. No válido en boletería y terminales ATM. No aplica sobre tarifas de jubilados y/o menores, ni funciones de precios reducido. No podrán ser utilizados en festivales, Avant premieres, eventos especiales. Sujeta a capacidad y disponibilidad de salas y a eventuales restricciones de películas. Válido hasta agotar stock de 20.000 entradas. La presente promoción es válida sólo para consumos de tipo familiar. Los descuentos publicados no son acumulables con otras promociones vigentes. Conforme Res. 915/2017 y Res. 240 E/2017. El producto ofrecido corresponde a la cartera de consumo."
Club Crónica,n/a,"Lunes, Martes, Miércoles, Jueves, Viernes, Sábado, Domingo",2x1,Cine,Atlas,,"2x1 en entradas 2D y 3D todos los días con la app Club Cronica
Para acceder al beneficio deberás solicitar un código a través de la APP de Club Crónica. Sólo se aceptará un código por transacción por día y por película. El uso está sujeto a capacidad de salas y restricciones de películas que serán informadas en cada caso en la boletería del complejo. La promoción aplica sobre la entrada de mayor valor del complejo y no aplica sobre tarifas de precios reducidos. Ambas entradas deberán ser utilizadas el mismo día horario y sala. La promoción no es válida para eventos especiales, avant premiere, contenido alternativo. No combinable con otras promociones, descuentos o precios especiales."
Club Movistar,n/a,"Lunes, Martes, Miércoles, Jueves, Viernes, Sábado, Domingo",2x1,Cine,Atlas,,"2x1 en entradas 2D y 3D todos los días con Club Movistar
Para acceder al beneficio deberás solicitar un código en www.clubmovistar.com.ar . El código deberá ser ingresado en www.atlascines.com, terminales ATM o presentarse en boletería de los complejos adheridos al momento de realizar la compra. Sólo se aceptará un código por transacción por día y por película. El uso está sujeto a capacidad de salas y restricciones de películas que serán informadas en cada caso en la boletería del complejo. La promoción aplica sobre la entrada de mayor valor del complejo y no aplica sobre tarifas de precios reducidos. Ambas entradas deberán ser utilizadas el mismo día horario y sala. La promoción no es válida para eventos especiales, avant premiere, contenido alternativo. No combinable con otras promociones, descuentos o precios especiales."
Cupon Star HR,n/a,"Lunes, Martes, Miércoles, Jueves, Viernes, Sábado, Domingo",2x1,Cine,Atlas,,"2x1 en entradas 2D y 3D todos los días con Cupon Star HR
Para acceder al beneficio solicitar un código en una plataforma administrada por Cupon Star HR. El código deberá ser ingresado en www.atlascines.com, terminales ATM o presentarse en boletería del complejo al momento de realizar la compra. Sólo se aceptará un código por transacción por día y por película. El uso está sujeto a capacidad de salas y restricciones de películas que serán informadas en cada caso en la boletería del complejo. La promoción aplica sobre la entrada de mayor valor del complejo y no aplica sobre tarifas de precios reducidos. Ambas entradas deberán ser utilizadas el mismo día horario y sala. La promoción no es válida para eventos especiales, avant premiere, contenido alternativo. No combinable con otras promociones, descuentos o precios especiales."
Club La Nación,n/a,"Domingo, Lunes, Martes, Miércoles, Jueves, Viernes, Sábado",2x1,Cine,Atlas,,"El beneficio solo es aplicable a compras dentro de la web, no es validos en compras en boletería. Solo se aceptará una tarjeta de membresía por transacción, por día y por película. El uso esta sujeto a la capacidad de las salas y restricción de películas que será informada en la web. La promoción aplica sobre el valor de la entrada general del complejo seleccionado. Ambas entradas deben ser utilizadas en el mismo complejo en la misma película en el mismo horario. La promoción no es válida para eventos especiales, Avant Premiere o contenido alternativo. No combinable con otras promociones, descuentos o precios especiales. El beneficio no es transferible."
Clarín 365,n/a,"Lunes, Martes, Miércoles, Jueves, Viernes, Sábado, Domingo",2x1,Cine,Atlas,,"El beneficio solo es aplicable a compras dentro de la web, no es validos en compras en boletería. Solo se aceptará una tarjeta de membresía por transacción, por día y por película. El uso esta sujeto a la capacidad de las salas y restricción de películas que será informada en la web. La promoción aplica sobre el valor de la entrada general del complejo seleccionado. Ambas entradas deben ser utilizadas en el mismo complejo en la misma película en el mismo horario. La promoción no es válida para eventos especiales, Avant Premiere o contenido alternativo. No combinable con otras promociones, descuentos o precios especiales. El beneficio no es transferible."
Galicia Más Premiun,n/a,Lunes,10%,Combustible,Axion,$10.000,"Por cliente, por mes. EXCLUSIVAMENTE, PARA LOS CLIENTES CON TARJETA DE CRÉDITO MASTERCARD PREMIER BLACK LA BONIFICACIÓN DEL 10% (DIEZ POR CIENTO) DE DESCUENTO."
Mi Carrefour Crédito,n/a,Martes,10%,Combustible,Axion,$3.000,"​PROMOCIÓN 10% DE DESCUENTO ABONANDO CON TARJETA MI CARREFOUR CREDITO FÍSICA. VALIDA LOS DIAS MARTES DESDE EL 01 DE MARZO AL 31 DE MARZO DE 2025. TOPE DE DEVOLUCION MENSUAL: $3.000 (TRES MIL) POR CUENTA. SOLO PARA CONSUMO FAMILIAR. EL DESCUENTO SE VERA REFLEJADO EN EL RESUMEN DE CUENTA DE LA TARJETA MI CARREFOUR CREDITO DENTRO DE LOS 30 DÍAS DE REALIZADA LA CARGA DE COMBUSTIBLE. NO ACUMULABLE CON OTRAS PROMOCIONES NI DESCUENTOS VIGENTES.OTORGA BANCO DE SERVICIOS FINANCIEROS S.A. INSCRIPTA EN EL RPC EL 14/07/1998, CON N° 5705, L II DE SA, BERUTI 2915, CABA (C1425BBI)"
Mi Carrefour Prepaga,n/a,Martes,5%,Combustible,Axion,$2.000,"PROMOCIÓN 5% DE DESCUENTO ABONANDO CON TARJETA MI CARREFOUR PREPAGA FÍSICA. VALIDA LOS DIAS MARTES DESDE EL 01 DE MARZO​ AL 31 DE MARZO DE 2025.​TOPE DE DEVOLUCION MENSUAL: $2000 (DOS MIL) POR CUENTA. SOLO PARA CONSUMO FAMILIAR. EL DESCUENTO SE VERA REFLEJADO EN LA CUENTA DE LA TARJETA MI CARREFOUR PREPAGA DENTRO DE LOS 30 DÍAS DE REALIZADA LA CARGA DE COMBUSTIBLE. NO ACUMULABLE CON OTRAS PROMOCIONES NI DESCUENTOS VIGENTES. OTORGA BANCO DE SERVICIOS FINANCIEROS S.A. INSCRIPTA EN EL RPC EL 14/07/1998, CON N° 5705, L II DE SA, BERUTI 2915, CABA (C1425BBI).​​"
Banco Galicia,MODO,Lunes,10%,Combustible,Axion,$10.000,"CARTERA DE CONSUMO (1). Promoción del 10% de ahorro en compras realizadas, en el país, para clientes Galicia. Tope de reintegro $10.000 por cliente, por mes. Válida todos los días lunes comprendidos entre el 01/03/2025 y el 31/03/2025 para compras realizadas con Tarjeta Galicia Mastercard escaneando el QR de MODO desde la app Galicia y/o MODO. No aplica para pagos con dinero en cuenta y/o transferencia. Promoción valida únicamente en las estaciones de servicio de YPF, Shell, Puma Energy y Axion en la compra de combustible. El importe ahorrado se acreditará dentro de los 10 días hábiles posteriores a la compra en la caja de ahorro común. Para acceder a la promoción, el participante deberá tener abierta una caja de ahorro común en el Banco, en donde se acreditará el monto del reintegro. Si el cliente tuviera más de una cuenta, el crédito se realizará en cualquiera de ellas a elección del Banco. Dicha promoción no es acumulable con otras promociones vigentes. Ejemplo: En una compra de $1000 en un pago: el importe del ahorro es de $100. No aplica para compras realizadas con tarjetas de Credito Visa Business, Visa Rural y Tarjetas de Débito emitidas a por Anses para Asignación Universal por hijo ni Progresar. La promoción no aplica a pagos a través de billeteras virtuales (excepto Modo), mPos y/o plataformas de pago online. MODO es marca registrada por Play Digital S.A., CUIT 30-71682943-6, con domicilio en Av. del Libertador 7208, Torre II, Piso 4, CABA (“PDSA”) y es un Proveedor de Servicios Tecnológicos de Banco de Galicia y Buenos Aires S.A.U. Sólo podrán participar de la promoción aquellos clientes que al momento de comprar se encuentren al día con sus productos. Banco Galicia solo es el medio de pago para la adquisición del producto/servicio."
Banco Galicia Eminent,MODO,Lunes,15%,Combustible,Axion,$15.000,"CARTERA DE CONSUMO (2). Promoción del 15% de ahorro en compras realizadas, en el país, para clientes Éminent. Tope de reintegro $15.000 por cliente, por mes. Válida todos los días lunes comprendidos entre el 01/03/2025 y el 31/03/2025 para compras realizadas con Tarjeta Galicia Mastercard Eminent escaneando el QR de MODO desde la app Galicia y/o MODO. No aplica para pagos con dinero en cuenta y/o transferencia. Promoción valida únicamente en las estaciones de servicio de YPF, Shell, Puma Energy y Axion en la compra de combustible. El importe ahorrado se acreditará dentro de los 10 días hábiles posteriores a la compra en la caja de ahorro común. Para acceder a la promoción, el participante deberá tener abierta una caja de ahorro común en el Banco, en donde se acreditará el monto del reintegro. Si el cliente tuviera más de una cuenta, el crédito se realizará en cualquiera de ellas a elección del Banco. Dicha promoción no es acumulable con otras promociones vigentes. Ejemplo: En una compra de $1000 en un pago: el importe del ahorro es de $150. No aplica para compras realizadas con tarjetas de Credito Visa Business, Visa Rural y Tarjetas de Débito emitidas a por Anses para Asignación Universal por hijo ni Progresar. La promoción no aplica a pagos a través de billeteras virtuales (excepto Modo), mPos y/o plataformas de pago online. MODO es marca registrada por Play Digital S.A., CUIT 30-71682943-6, con domicilio en Av. del Libertador 7208, Torre II, Piso 4, CABA (“PDSA”) y es un Proveedor de Servicios Tecnológicos de Banco de Galicia y Buenos Aires S.A.U. Sólo podrán participar de la promoción aquellos clientes que al momento de comprar se encuentren al día con sus productos. Banco Galicia solo es el medio de pago para la adquisición del producto/servicio."
Reba American Express,n/a,Viernes,20%,Combustible,Axion,$5.000,"BENEFICIO VÁLIDO ÚNICAMENTE PARA CONSUMOS REALIZADOS LOS DÍAS VIERNES, DESDE EL 01/03​/2025 al 31/03/2025 INCLUSIVE PARA TITULARES Y ADICIONALES DE LAS TARJETAS DE CRÉDITO AMERICAN EXPRESS, EMITIDAS POR REBA, LA APP DE REBA COMPAÑÍA FINANCIERA S.A (LOS ""SOCIOS"" Y LAS ""TARJETAS""). LOS SOCIOS ACCEDERÁN A UN 20% DE DESCUENTO EN CARGA DE COMBUSTIBLE EN LAS ESTACIONES DE SERVICIO AXION PARTICIPANTES, EL CUAL SE VERÁ REFLEJADO DENTRO DE LOS DOS RESÚMENES DE CUENTA SIGUIENTES AL MES EN EL CUAL SE REALIZARON LAS TRANSACCIONES. LA PROMOCIÓN TIENE UN TOPE DE REINTEGRO DE $5.000 (CINCO MIL PESOS ARGENTINOS) POR MES Y POR SOCIO. BENEFICIO APLICABLE A LA SIGUIENTE ENTIDAD EMISORA DE TARJETAS AMERICAN EXPRESS: REBA LA APP DE REBA COMPAÑÍA FINANCIERA S.A. MÁS INFORMACIÓN EN www.americanexpress.com.ar/experiences. NO APLICABLE PARA PAGOS A TRAVÉS DE BILLETERAS Y/O PLATAFORMAS DIGITALES. El proveedor de los productos o servicios es el exclusivo responsable por su prestación, funcionamientos y garantía, Reba Compañía Financiera S.A. solo provee el medio de pago para adquirirlos. Reba Compañía Financiera S.A, CUIT 30-62828435-7, Maipú 272, CABA."
Galicia Más,n/a,Lunes,10%,Combustible,Axion,$6.000,"EXCLUSIVAMENTE, PARA LOS CLIENTES CON TARJETA DE CRÉDITO MASTERCARD PREMIER LA BONIFICACIÓN DEL 10% (DIEZ POR CIENTO) DE DESCUENTO"
Banco Patagonia,MODO,Jueves,20%,Combustible,Axion,$3.000,"​DESDE EL 01/03/2025 AL 31/03/2025 ABONANDO LOS JUEVES CON LA TARJETA DE DÉBITO PATAGONIA 24 Y LAS TARJETAS DE CREDITO EMITIDAS POR BANCO PATAGONIA S.A., RECIBIRÁN UN 20% DE DESCUENTO EN LOS COMERCIOS REGISTRADOS BAJO EL RUBRO COMBUSTIBLE. TOPE DE DEVOLUCIÓN POR CUENTA Y POR MES: $3.000 (TRES MIL). NO ACUMULABLE CON OTRAS PROMOCIONES VIGENTES. EL IMPORTE AHORRADO EN LAS COMPRAS REALIZADAS CON LAS TARJETAS DE DÉBITO DEL BANCO SERÁ ACREDITADO EN LA CUENTA DE DÉBITO, DENTRO DE LOS 10 DÍAS HÁBILES DE REALIZADA LA OPERACIÓN. LOS REINTEGROS CORRESPONDIENTES A LAS COMPRAS EFECTUADAS CON LAS TARJETAS DE CRÉDITO VISA, MASTERCARD Y AMERICAN EXPRESS DEL BANCO SE VISUALIZARÁN EN EL RESUMEN EN QUE INGRESE LA PRIMERA CUOTA Y/O EN EL INMEDIATO POSTERIO BANCO PATAGONIA S.A. NO SE RESPONSABILIZA POR LOS CUPONES PRESENTADOS FUERA DE LAS FECHAS DE VIGENCIA DE LAS PROMOCIONES. LAS CUENTAS NO DEBERÁN REGISTRAR MORA. ES CONDICION TENER ADHERIDA A MODO LA CUENTA DE BANCO PATAGONIA. LA MARCA MODO ES PROPIEDAD DE PLAY DIGITAL, CUIT 30-71682943-6, DOMICILIO EN AV. LEANDRO ALEM 882, CABA. LA PROMOCION NO ES APLICABLE EN NINGUN PLAN AHORA. EL BENEFICIO NO APLICA PARA PAGOS EFECTUADOS A TRAVÉS DE BILLETERAS VIRTUALES NI EN COMERCIOS QUE COBREN CON POST MÓVILES/POSTNET DE PLATAFORMAS DE PAGO Y/O PORTALES DE PAGO ON LINE A EXCEPCION DE MODO"
Galicia Más,n/a,Viernes,10%,Combustible,Axion,$6.000,"EXCLUSIVAMENTE, PARA LOS CLIENTES CON TARJETA DE CRÉDITO MASTERCARD PREMIER LA BONIFICACIÓN DEL 10% (DIEZ POR CIENTO) DE DESCUENTO"
BBVA,MODO,Sábado,20%,Combustible,Axion,$6.000,"CARTERA DE CONSUMO. PROMOCIÓN VÁLIDA TODOS LOS SÁBADOS DESDE  01/03/2025 HASTA 31/03/2025 INCLUSIVE. APLICA EL 20% DE REINTEGRO PARA CLIENTES REGISTRADOS EN ON, EL PROGRAMA DE DESCUENTOS Y BENEFICIOS DE AXION, CON EL REGISTRO CONFIRMADO AL MENOS 72 HORAS PREVIAS A REALIZAR LA COMPRA, QUE COBREN EL SUELDO EN BBVA Y QUE COMPREN EXCLUSIVAMENTE A TRAVÉS DE MODO EN UN PAGO CON TARJETAS DE CRÉDITO EMITIDAS POR BBVA ESCANEANDO EL CÓDIGO QR A TRAVÉS DE BBVA GO, APP BBVA O MODO Y QUE TENGAN UNA CAJA DE AHORRO EN PESOS ACTIVA EN BBVA VINCULADA A MODO PARA PODER RECIBIR LA ACREDITACIÓN DEL REINTEGRO. TOPE DE $6.000 POR USUARIO POR MES. NO INCLUYE COMPRAS REALIZADAS POR ADICIONALES. PARA ACCEDER AL BENEFICIO LOS CLIENTES DEBEN ESTAR REGISTRADOS EN ON. EL REINTEGRO SE ACREDITARÁ DENTRO DE LOS 30 DÍAS HÁBILES POSTERIORES A LA COMPRA EN LA CAJA DE AHORRO BBVA VINCULADA A MODO. ACUMULA ÚNICAMENTE CON PROMOCIONES DE MODO. LA PROMOCIÓN NO APLICA A PAGOS REALIZADOS A TRAVÉS DE OTRAS BILLETERAS VIRTUALES Y/O PLATAFORMAS DE PAGO ONLINE (POR EJEMPLO, PAYPAL, MERCADO PAGO, UALÁ, ETC.). EL PROGRAMA DE DESCUENTOS Y BENEFICIOS ON ES DE EXCLUSIVA PROPIEDAD Y ADMINISTRACIÓN DE PAN AMERICAN ENERGY, S.L., SUCURSAL ARGENTINA. LOS ACCIONISTAS DE BANCO BBVA ARGENTINA S.A. LIMITAN SU RESPONSABILIDAD A LA INTEGRACIÓN DE LAS ACCIONES SUSCRIPTAS LEY 19.550 Y LEY 25.738. CUIT 30-50000319-3. AVDA.CÓRDOBA 111- PISO 31 CABA - CP 1054AAA.​"
Banco Supervielle,MODO,Sábado,20%,Combustible,Axion,Sin tope de reintegro.,n/a
Banco Santa Fe,MODO,Viernes,10%,Combustible,Axion,$4.000,"​Vigencia desde el 01/03/2025 al 31/03/2025. Hasta 10% de reintegro todos los viernes abonando en 1 pago con tarjetas de crédito emitidas por el Nuevo Banco de Santa Fe S.A. tope de reintegro semanal: $4.000 por cuenta por mes. Beneficio exclusivo para tarjetas de crédito Black, Platinum Y Signature. Bonificación aplicable sobre precio de contado. Válida en los comercios de la República Argentina registrados ante Prisma Medios de Pago s.a. (Visa) y Fiserv (Mastercard) bajo el rubro combustibles. No válido para compras realizadas en comercios que procesen sus ventas con múltiples tarjetas de crédito a través de plataforma única de pago en la cual no se individualice ni identifiquen comercio ni rubro ni online como ser mercado pago, QR y/o similares. Consulte rubros y procesamiento de pagos en el comercio antes de realizar el consumo. Ejemplo: en una compra con tarjeta de crédito realizada por $ 80.000 precio de contado Ud. recibirá en el resumen de su tarjeta de crédito un consumo de $ 80.000 y un reintegro de $ 4.000 en el resumen en el cual ingrese el consumo o en el posterior. La efectivización del total del descuento será efectuada vía reintegro en el resumen en el cual ingrese el consumo o en el posterior dependiendo de la fecha de compra y del cierre de la facturación de la tarjeta. El tope de reintegro se calcula por periodos mensuales, considerando la suma de las compras efectuadas por el titular con tarjeta de crédito y sus adicionales. No acumulable con otras promociones vigentes. Nuevo Banco de Santa Fe S.A. solo informa el medio y las condiciones para el pago de los productos/servicios ofrecidos por el proveedor. Previo a la contratación del producto o servicio, verifique con el proveedor sus condiciones y alcance de la garantía. Nuevo Banco de Santa Fe S.A - cCt 30-69243266-1 - San Martín 715, Rosario, Provincia de Santa Fe."
Banco Santa Cruz,MODO,Viernes,10%,Combustible,Axion,$4.000,"Beneficio exclusivo para tarjetas de crédito Black, Platinum y Signature"
Brubank,n/a,Martes,10%,Combustible,Axion,$1.000,"LA PROMOCIÓN SERÁ VÁLIDA PARA RESIDENTES EN EL ÁMBITO DE LA REPÚBLICA ARGENTINA, EXCEPTO RESIDENTES DE LAS PROVINCIAS DE TIERRA DEL FUEGO, RÍO NEGRO, MENDOZA, NEUQUÉN Y SALTA, LOS DÍAS MARTES DENTRO DEL PERÍODO DEL PERÍODO DE LAS 00:00 DEL DÍA 1 DE MARZO DE 2025 HASTA LAS 23:59 HORAS DEL DÍA 31 DE MARZO DE 2025, INCLUSIVE, EXCLUSIVAMENTE PARA LOS CLIENTES CON TARJETA DE DÉBITO VISA BRUBANK. DESCUENTO DEL 10% (DIEZ POR CIENTO), CON UN TOPE DE REINTEGRO DE $1.000 (MIL PESOS) POR TRANSACCIÓN. LAS BONIFICACIONES SE VERÁN REFLEJADAS COMO UN CRÉDITO EN EL PRIMER O SEGUNDO RESUMEN DE CUENTA QUE SE EMITA CON POSTERIORIDAD A LA FECHA DE COMPRA. EL BENEFICIO DE CUOTAS SIN INTERÉS (EN CASO DE CORRESPONDER), SERÁ OTORGADO POR EL COMERCIO, EN EL MOMENTO DE ABONARSE LA COMPRA. ENCONTRÁ MÁS INFORMACIÓN EN: https://help.brubank.com/es/articles/9010023-todos-los-martes-10-off-en-la-carga-de-combustible-en-axion-energy-compra-con-tu-tarjeta-de-debito-visa-brubank-y-gira-la-ruedita​"
Brubank,n/a,"Lunes, Martes, Miércoles, Viernes, Sábado, Jueves, Domingo",20%,Combustible,Axion,$2.000,"LA PROMOCIÓN SERÁ VÁLIDA PARA RESIDENTES EN EL ÁMBITO DE LA REPÚBLICA ARGENTINA, EXCEPTO RESIDENTES DE LAS PROVINCIAS DE TIERRA DEL FUEGO, RÍO NEGRO, MENDOZA, NEUQUÉN Y SALTA, TODOS LOS DÍAS DENTRO DEL PERÍODO DE LAS 00:00 DEL DÍA 1 DE MARZO HASTA LAS 23:59 HORAS DEL DIA 31 DE MARZO DE 2025, INCLUSIVE, EXCLUSIVAMENTE PARA CLIENTES BRUPLUS. DESCUENTO DEL 20% (VEINTE POR CIENTO), CON UN TOPE DE REINTEGRO DE $2.000 (DOS MIL) HASTA 5 CONSUMOS MENSUALES.  
ENCONTRÁ MÁS INFORMACIÓN EN: https://help.brubank.com/es/articles/9010641-todos-los-dias-20-off-en-axion-energy-compra-con-tu-tarjeta-de-debito-visa-brubank-y-gira-la-ruedita​"
Banco Nación,MODO,"Lunes, Martes, Miércoles, Jueves, Viernes, Sábado, Domingo",10%,Combustible,Axion,$15.000,TARJETAS DE CRÉDITO VISA Y MASTERCARD DEL BANCO NACIÓN PAGANDO EXCLUSIVAMENTE CON MODO BNA+.
Banco Entre Rios,MODO,Viernes,10%,Combustible,Axion,$4.000,"Beneficio exclusivo para tarjetas de crédito Black, Platinum y Signature"
Banco del Sol,n/a,Miércoles,20%,Combustible,Axion,$5.000 ,"Cartera de Consumo. La presente acción promocional es organizada por Banco del Sol S.A., CUIT N° 30-67793756-0, con domicilio en Av. Leandro N. Alem 1058, PB, Ciudad Autónoma de Buenos Aires (en adelante ""El Banco"" o “BDS""). Promoción exclusiva para clientes de BDS que se hayan registrado a través de la aplicación del Banco y que realicen compras con la tarjeta de débito VISA emitida por el Banco, los miércoles desde las 00:00hs del 01/03/2025, hasta las 23:59hs del 31/03/2025 ambas inclusive (en adelante el “Plazo""), en estaciones de servicio de Axion Energy. El beneficio consistirá en un 20% (VEINTE POR CIENTO) de descuento, con un tope de reintegro de $5.000 (CINCO MIL PESOS) por mes, sobre las compras efectuadas. El beneficio será reintegrado dentro de los 10 (diez) días corridos posteriores a la compra. Por ejemplo, si un cliente realiza una compra de $10.000 (diez mil pesos), recibirá un reintegro de $2.000 (dos mil pesos). No acumulable con otros beneficios y/o promociones vigentes. No aplica sobre productos incluidos en programas gubernamentales. Quedan excluidos de participar, aquellos clientes cuyas cuentas se encuentren en mora y/o bloqueadas por cualquier motivo. La promoción no aplica a pagos a través de billeteras virtuales, plataformas de pago y/o portales de pago online, con excepción de la aplicación de Axion Energy. En caso de consultas o reclamos, deberán comunicarse a través de los canales de contacto disponibles por El Banco. Los presentes términos y condiciones se encuentran disponibles en https://www.bancodelsol.com"
Banco San Juan,MODO,Viernes,10%,Combustible,Axion,$4.000,"Vigencia desde el 01/03/2025 al 31/03/2025. Hasta 10% de reintegro todos los viernes abonando en 1 pago con tarjetas de crédito emitidas por el Banco San Juan S.A. tope de reintegro semanal: $ 4.000 por cuenta por mes. Beneficio exclusivo para tarjetas de crédito Black, Platinum Y Signature. Bonificación aplicable sobre precio de contado. Válida en los comercios de la República Argentina registrados ante Prisma Medios de Pago s.a. (Visa) y Fiserv (Mastercard) bajo el rubro combustibles. No válido para compras realizadas en comercios que procesen sus ventas con múltiples tarjetas de crédito a través de plataforma única de pago en la cual no se individualice ni identifiquen comercio ni rubro ni online como ser mercado pago, QR y/o similares. Consulte rubros y procesamiento de pagos en el comercio antes de realizar el consumo. Ejemplo: en una compra con tarjeta de crédito realizada por $ 80.000 precio de contado Ud. recibirá en el resumen de su tarjeta de crédito un consumo de $ 80.000 y un reintegro de $ 4.000 en el resumen en el cual ingrese el consumo o en el posterior. La efectivización del total del descuento será efectuada vía reintegro en el resumen en el cual ingrese el consumo o en el posterior dependiendo de la fecha de compra y del cierre de la facturación de la tarjeta. El tope de reintegro se calcula por periodos mensuales, considerando la suma de las compras efectuadas por el titular con tarjeta de crédito y sus adicionales. No acumulable con otras promociones vigentes. Válido para cartera de consumo. Banco de San Juan S.A. - CUIT 30-50000944-2 –Av. Ignacio de la Roza 85 oeste, Capital, San Juan."
Banco Comafi,MODO,Domingo,10%,Combustible,Axion,$4.000,Por semana.
Banco Ciudad,MODO,Domingo,10%,Combustible,Axion,$10.000,"Por cliente por mes se adicionará un 5% (cinco por ciento) de descuento en el total de la compra con tope de reintegro de $5.000 mensual por cliente para todos los comercios adheridos de las estaciones Axion, Ypf y Shell"
Mercado Pago,n/a,Jueves,15%,Supermercados,Carrefour,Sin tope de reintegro,"BENEFICIO VÁLIDO EXCLUSIVAMENTE DURANTE LOS JUEVES DE MARZO 2025 EN LA REPÚBLICA ARGENTINA PARA PAGOS REALIZADOS A TRAVÉS DEL SERVICIO DE PROCESAMIENTO DE PAGOS DE MERCADO PAGO OPERADO POR MERCADOLIBRE S.R.L. “MERCADO PAGO” A TRAVÉS DEL ESCANEO DEL CÓDIGO QR CON LA APP DE MERCADO PAGO LA “APP”, ELIGIENDO COMO MEDIO DE PAGO DINERO EN CUENTA. EL BENEFICIO CONSISTE EN UN 15% DE DESCUENTO, SIN TOPE DE REINTEGRO, EN TODA TU COMPRA EN TODAS LAS SUCURSALES DE HIPERMERCADOS CARREFOUR, CARREFOUR MARKET Y CARREFOUR EXPRESS ""EL “BENEFICIO”. NO VALIDO PARA WWW.CARREFOUR.COM.AR NI CARREFOUR MAXI. EL BENEFICIO ESTARÁ A CARGO DE INC S.A. Y SE REALIZARÁ EN LÍNEA DE CAJAS SOBRE EL PRECIO DE CONTADO. MERCADO PAGO NO ES UNA ENTIDAD FINANCIERA. LOS FONDOS EN CUENTAS DE PAGO NO SON DEPÓSITOS GARANTIZADOS. MERCADOLIBRE S.R.L. CUIT 30703088534, CASEROS 3039, PISO 2º, CABA”. PROMOCIÓN NO VÁLIDA PARA COMPRAS EN CUOTAS CON TARJETAS DE CRÉDITO EMITIDAS EN EL EXTERIOR, TARJETAS DE COMPRA Y/U ORDEN DE COMPRA Y/O SIMILARES EMITIDAS POR CARREFOUR ARGENTINA, COMPRAS ABONADAS EN EUROS, DÓLARES NI TICKETS O CON LA APLICACIÓN DE MERCADO PAGO NI TARJETAS DE PROGRAMAS DE AYUDA SOCIAL.SOLO PARA CONSUMO FAMILIAR. PARA MÁS INFORMACIÓN COMUNÍQUESE GRATUITAMENTE AL TELÉFONO 0 800 444 8484."
